cluster_rank,cluster_id,category,board,title,summary,status,votes,comments,url
68,67,posts / ago / export / csv,feature suggestions,"Export Posts/Drafts to a file (PDF, CSV, etc.)","Export Posts/Drafts to a file (PDF, CSV, etc.). Buffer Sign in with Buffer Feature Suggestions Roadmap What's New 25 25 Export Posts/Drafts to a file (PDF, CSV, etc.) I want to be able to build all of my Social Media...",in progress,,26,https://suggestions.buffer.com/p/export-posts-drafts-to-a-file-pdf-csv-etc?b=feature-suggestions
69,68,posts / ago / delete / post,feature suggestions,Delete a Post after it's been posted,"Delete a Post after it's been posted. Buffer Sign in with Buffer Feature Suggestions Roadmap What's New 24 24 Delete a Post after it's been posted Need to have able to delete a Tweet after post it and Retweet, these two...",in progress,,26,https://suggestions.buffer.com/p/delete-a-post-after-it-s-been-posted?b=feature-suggestions
70,69,posts / duplicate / year / ago,feature suggestions,"Bulk duplicate, copy, re-share posts","Bulk duplicate, copy, re-share posts. Buffer Sign in with Buffer Feature Suggestions Roadmap What's New 24 24 Bulk duplicate, copy, re-share posts I would like to make posts once for a full year and once I'm finished...",in progress,,26,https://suggestions.buffer.com/p/bulk-duplicate-copy-re-share-posts?b=feature-suggestions
71,70,join / turn / shake / shuffle,feature suggestions,Please allow us to turn off the shake to shuffle feature,Please allow us to turn off the shake to shuffle feature. Buffer Sign in with Buffer Feature Suggestions Roadmap What's New 21 21 Please allow us to turn off the shake to shuffle feature It just is really tough to use...,in progress,,26,https://suggestions.buffer.com/p/please-allow-us-to-turn-off-the-shake-to-shuffle-feature?b=feature-suggestions
72,71,post / posts / community / share,feature suggestions,Schedule a post for a community on X,"Schedule a post for a community on X. Buffer Sign in with Buffer Feature Suggestions Roadmap What's New 20 20 Schedule a post for a community on X I would really like the ability to post to communities on X, as well as...",in progress,,26,https://suggestions.buffer.com/p/schedule-a-post-for-a-community-on-x?b=feature-suggestions
73,72,ago / channels / api / post,feature suggestions,Custom channels via Webhooks,Custom channels via Webhooks. Buffer Sign in with Buffer Feature Suggestions Roadmap What's New 20 20 Custom channels via Webhooks Add your own channel via API. Create a webhook so that I can get a scheduled update...,complete,,26,https://suggestions.buffer.com/p/custom-channels-via-webhooks?b=feature-suggestions
74,73,mastodon / character / limit / ago,feature suggestions,Increase character limit for Mastodon,Increase character limit for Mastodon. Buffer Sign in with Buffer Feature Suggestions Roadmap What's New 19 19 Increase character limit for Mastodon Hi! Do you know that - Mastodon provides 1000 symbols per post. Not...,in progress,,26,https://suggestions.buffer.com/p/increase-character-limit-for-mastodon?b=feature-suggestions
75,74,post / posting / posts / batch-edit,feature suggestions,Batch-edit posting schedules,Batch-edit posting schedules. Buffer Sign in with Buffer Feature Suggestions Roadmap What's New 18 18 Batch-edit posting schedules The ability to edit the schedule across all channels at once. Comments Join the...,in progress,,26,https://suggestions.buffer.com/p/batch-edit-posting-schedules?b=feature-suggestions
76,75,posts / post / multiple / platforms,feature suggestions,Make AI posts for multiple platforms at once,Make AI posts for multiple platforms at once. Buffer Sign in with Buffer Feature Suggestions Roadmap What's New 18 18 Make AI posts for multiple platforms at once I asked your AI assistant to suggest content for three...,in progress,,26,https://suggestions.buffer.com/p/make-ai-posts-for-multiple-platforms-at-once?b=feature-suggestions
77,76,time / set / default / publish,feature suggestions,Set default publish time per channel,"Set default publish time per channel. Buffer Sign in with Buffer Feature Suggestions Roadmap What's New 17 17 Set default publish time per channel I want to save time when setting my posts, so I want to set a default...",in progress,,26,https://suggestions.buffer.com/p/set-default-publish-time-per-channel?b=feature-suggestions
78,77,ago / manager / mention / posts,feature suggestions,Mention Manager,Mention Manager. Buffer Sign in with Buffer Feature Suggestions Roadmap What's New 17 17 Mention Manager We are looking for something similar to the hashtag manager where you can create premade lists of @ tags. This is...,open,,26,https://suggestions.buffer.com/p/mention-manager?b=feature-suggestions
79,78,plan / posts / free / unlimited,feature suggestions,A plan between the free plan and unlimited posts.,A plan between the free plan and unlimited posts.. Buffer Sign in with Buffer Feature Suggestions Roadmap What's New 15 15 A plan between the free plan and unlimited posts. Hi. I want to make a suggestion about your...,in progress,,26,https://suggestions.buffer.com/p/a-plan-between-the-free-plan-and-unlimited-posts?b=feature-suggestions
80,79,suggestions / hashtags / post / hashtag,feature suggestions,Hashtag suggestions/lookup,"Hashtag suggestions/lookup. Buffer Sign in with Buffer Feature Suggestions Roadmap What's New 15 15 Hashtag suggestions/lookup First of all, the hashtag editing box is very small and can’t be expanded. It makes it...",in progress,,26,https://suggestions.buffer.com/p/hashtag-suggestions-lookup?b=feature-suggestions
81,80,post / draft / ago / drafts,feature suggestions,Draft -> Post workflow,"Draft -> Post workflow. Buffer Sign in with Buffer Feature Suggestions Roadmap What's New 15 15 Draft -> Post workflow It is confusing that a draft stays in drafts, even after you have created a post based on that...",in progress,,26,https://suggestions.buffer.com/p/draft-post-workflow?b=feature-suggestions
82,81,pdf / report / comments / functional,feature suggestions,A Functional Buffer Report to PDF Option,"A Functional Buffer Report to PDF Option. Buffer Sign in with Buffer Feature Suggestions Roadmap What's New 14 14 A Functional Buffer Report to PDF Option Currently, if you click “Export as PDF” for any social media...",in progress,,26,https://suggestions.buffer.com/p/a-functional-buffer-report-to-pdf-option?b=feature-suggestions
83,82,screen / widget / home / capture,feature suggestions,iOS - create ideas home screen widget,iOS - create ideas home screen widget. Buffer Sign in with Buffer Feature Suggestions Roadmap What's New 14 14 iOS - create ideas home screen widget Wouldn’t it be great to quickly capture an idea as you have it ? A...,in progress,,26,https://suggestions.buffer.com/p/ios-create-ideas-home-screen-widget?b=feature-suggestions
84,83,copy / paste / text / years,feature suggestions,Fix copy/paste inside of text editing,"Fix copy/paste inside of text editing. Buffer Sign in with Buffer Feature Suggestions Roadmap What's New 14 14 Fix copy/paste inside of text editing Particularly with making Twitter threads, it’s common to copy/paste...",in progress,,26,https://suggestions.buffer.com/p/fix-copy-paste-inside-of-text-editing?b=feature-suggestions
85,84,ago / assistant / apps / app,feature suggestions,Support AI Assistant in Mobile apps,"Support AI Assistant in Mobile apps. Buffer Sign in with Buffer Feature Suggestions Roadmap What's New 14 14 Support AI Assistant in Mobile apps 1. I can't see ai in the mobile app, I want to use ai in the app as well....",in progress,,26,https://suggestions.buffer.com/p/support-ai-assistant-in-mobile-apps?b=feature-suggestions
86,85,youtube / edit / tags / default,feature suggestions,Ability to Edit Youtube Tags or ability to use Youtube Default settings,Ability to Edit Youtube Tags or ability to use Youtube Default settings. Buffer Sign in with Buffer Feature Suggestions Roadmap What's New 13 13 Ability to Edit Youtube Tags or ability to use Youtube Default settings I...,in progress,,26,https://suggestions.buffer.com/p/ability-to-edit-youtube-tags-or-ability-to-use-youtube-default-settings?b=feature-suggestions
87,86,post / posted / indication / sent,feature suggestions,"Restore iOS indication of ""This may have been previously posted"", or similar.","Restore iOS indication of ""This may have been previously posted"", or similar.. Buffer Sign in with Buffer Feature Suggestions Roadmap What's New 13 13 Restore iOS indication of ""This may have been previously posted"", or...",in progress,,26,https://suggestions.buffer.com/p/restore-ios-indication-of-this-may-have-been-previously-posted-or-similar?b=feature-suggestions
88,87,tier / posts / comments / basic,feature suggestions,A more basic subscription tier,A more basic subscription tier. Buffer Sign in with Buffer Feature Suggestions Roadmap What's New 13 13 A more basic subscription tier I don’t particularly care for all the extra engagement tools or data analysis...,in progress,,26,https://suggestions.buffer.com/p/a-more-basic-subscription-tier?b=feature-suggestions
89,88,target / linkedin / posts / ago,feature suggestions,Ability to target different audiences on LinkedIn,Ability to target different audiences on LinkedIn. Buffer Sign in with Buffer Feature Suggestions Roadmap What's New 13 13 Ability to target different audiences on LinkedIn We’d love to see a feature on Buffer where we...,in progress,,26,https://suggestions.buffer.com/p/ability-to-target-different-audiences-on-linkedin?b=feature-suggestions
90,89,api / ago / thread / threads,feature suggestions,Schedule Twitter Thread with API,Schedule Twitter Thread with API. Buffer Sign in with Buffer Feature Suggestions Roadmap What's New 13 13 Schedule Twitter Thread with API I'd like to be able to program and post threads via the API. This is currently...,in progress,,26,https://suggestions.buffer.com/p/schedule-twitter-thread-with-api?b=feature-suggestions
91,90,post / profiles / tagging / posts,feature suggestions,Tagging of users on posts,Tagging of users on posts. Buffer Sign in with Buffer Feature Suggestions Roadmap What's New 13 13 Tagging of users on posts Tagging people without having to @ mention them on posts would be super cool and helpful!...,in progress,,26,https://suggestions.buffer.com/p/tagging-of-users-on-posts?b=feature-suggestions
92,91,ago / years / channels / able,feature suggestions,Editing Drafts across multiple channels,Editing Drafts across multiple channels. Buffer Sign in with Buffer Feature Suggestions Roadmap What's New 13 13 Editing Drafts across multiple channels the ability to edit drafts for multiple channels as one -...,in progress,,26,https://suggestions.buffer.com/p/editing-drafts-across-multiple-channels?b=feature-suggestions
93,92,campaigns / better / post / comments,feature suggestions,Better organization of Campaigns/Tags,Better organization of Campaigns/Tags. Buffer Sign in with Buffer Feature Suggestions Roadmap What's New 13 13 Better organization of Campaigns/Tags I would really appreciate better options for sorting campaigns. I work...,in progress,,26,https://suggestions.buffer.com/p/better-organization-of-campaigns-tags?b=feature-suggestions
94,93,channels / team / admin / manage,feature suggestions,Extended Team Permissions (Owner / Super Admin / Admin / Member),Extended Team Permissions (Owner / Super Admin / Admin / Member). Buffer Sign in with Buffer Feature Suggestions Roadmap What's New 12 12 Extended Team Permissions (Owner / Super Admin / Admin / Member) I’d like to give...,in progress,,26,https://suggestions.buffer.com/p/extended-team-permissions-owner-super-admin-admin-member-3807e13a-fc3d-43fd-8f5b-ee3908b4a368?b=feature-suggestions
95,94,tag / native / app / posts,feature suggestions,X/Twitter: The ability to tag accounts on pictures like in the native app...,X/Twitter: The ability to tag accounts on pictures like in the native app.... Buffer Sign in with Buffer Feature Suggestions Roadmap What's New 12 12 X/Twitter: The ability to tag accounts on pictures like in the native...,in progress,,26,https://suggestions.buffer.com/p/x-twitter-the-ability-to-tag-accounts-on-pictures-like-in-the-native-app?b=feature-suggestions
96,95,post / posts / group / comments,feature suggestions,Group related posts for different channels,Group related posts for different channels. Buffer Sign in with Buffer Feature Suggestions Roadmap What's New 11 11 Group related posts for different channels When you create a post with the goal of sharing to multiple...,in progress,,26,https://suggestions.buffer.com/p/group-related-posts-for-different-channels?b=feature-suggestions
97,96,trial / reels / months / ago,feature suggestions,Instagram Trial Reels,Instagram Trial Reels. Buffer Sign in with Buffer Feature Suggestions Roadmap What's New 11 11 Instagram Trial Reels Have the possibility to post a trial reel on Instagram. Comments Join the discussion and help shape...,in progress,,26,https://suggestions.buffer.com/p/instagram-trial-reels?b=feature-suggestions
98,97,facebook / events / post / able,feature suggestions,Facebook events,Facebook events. Buffer Sign in with Buffer Feature Suggestions Roadmap What's New 11 11 Facebook events I would like to post events to a Facebook group. The Facebook UI is awful when dealing with timezones. Comments...,in progress,,26,https://suggestions.buffer.com/p/facebook-events?b=feature-suggestions
99,98,posts / post / placeholder / day,feature suggestions,Placeholder Queue Slot,Placeholder Queue Slot. Buffer Sign in with Buffer Feature Suggestions Roadmap What's New 11 11 Placeholder Queue Slot Problem: I can’t schedule some specific posts / formats via Buffer (pdf or survey on LinkedIn etc)....,in progress,,26,https://suggestions.buffer.com/p/placeholder-queue-slot?b=feature-suggestions
100,99,post / ago / comment / comments,feature suggestions,Auto-dm based on trigger,"Auto-dm based on trigger. Buffer Sign in with Buffer Feature Suggestions Roadmap What's New 10 10 Auto-dm based on trigger I post free resources on X and LinkedIn, where I ask people to comment a word (for example:...",closed,,26,https://suggestions.buffer.com/p/auto-dm-based-on-trigger?b=feature-suggestions
101,100,hashtags / automatically / image / content,feature suggestions,Automatically Add Hashtags Based on Image Content or Meta Data,Automatically Add Hashtags Based on Image Content or Meta Data. Buffer Sign in with Buffer Feature Suggestions Roadmap What's New 10 10 Automatically Add Hashtags Based on Image Content or Meta Data For an Instagram...,in progress,,26,https://suggestions.buffer.com/p/automatically-add-hashtags-based-on-image-content-or-meta-data?b=feature-suggestions
102,101,text / alt / images / main,feature suggestions,Alternative Text for Images,Alternative Text for Images. Buffer Sign in with Buffer Feature Suggestions Roadmap What's New 10 10 Alternative Text for Images Make it so users can add alt text to images from the main scheduling page. If there’s a...,open,,26,https://suggestions.buffer.com/p/alternative-text-for-images?b=feature-suggestions
103,102,mastodon / character / custom / setting,feature suggestions,"Mastodon, add custom setting for character legth","Mastodon, add custom setting for character legth. Buffer Sign in with Buffer Feature Suggestions Roadmap What's New 10 10 Mastodon, add custom setting for character legth Since each server in Mastodon can have different...",in progress,,26,https://suggestions.buffer.com/p/mastodon-add-custom-setting-for-character-legth?b=feature-suggestions
104,103,ideas / folders / idea / client,feature suggestions,Idea / client workspaces or folders,Idea / client workspaces or folders. Buffer Sign in with Buffer Feature Suggestions Roadmap What's New 10 10 Idea / client workspaces or folders Grouping ideas for each channel. I manage different companies and which to...,in progress,,26,https://suggestions.buffer.com/p/idea-client-workspaces-or-folders?b=feature-suggestions
105,104,ago / website / years / code,feature suggestions,Embed a social media feed on a website,Embed a social media feed on a website. Buffer Sign in with Buffer Feature Suggestions Roadmap What's New 10 10 Embed a social media feed on a website Please consider creating a code widget that would allow a post that...,in progress,,26,https://suggestions.buffer.com/p/embed-a-social-media-feed-on-a-website?b=feature-suggestions
106,105,ago / competitive / analytics / comparison,feature suggestions,Competitive Analytics Comparison,Competitive Analytics Comparison. Buffer Sign in with Buffer Feature Suggestions Roadmap What's New 10 10 Competitive Analytics Comparison feature allows Instagram account holders to benchmark and measure their account...,in progress,,26,https://suggestions.buffer.com/p/competitive-analytics-comparison?b=feature-suggestions
107,106,posts / months / ago / titles,feature suggestions,Titles for Posts,"Titles for Posts. Buffer Sign in with Buffer Feature Suggestions Roadmap What's New 9 9 Titles for Posts You can name posts while in the “create” feature, but not after they’re in draft form. It makes it hard to know...",in progress,,26,https://suggestions.buffer.com/p/titles-for-posts?b=feature-suggestions
108,107,loading / content / wait / grid,feature suggestions,Integrating Shop Grid with Start Page,"Integrating Shop Grid with Start Page. Buffer Sign in with Buffer Feature Suggestions Roadmap What's New 9 9 Integrating Shop Grid with Start Page The “Updates” section is taking up too much space on my start page, and...",in progress,,26,https://suggestions.buffer.com/p/integrating-shop-grid-with-start-page?b=feature-suggestions
109,108,label / posts / ago / setting,feature suggestions,AI label setting for posts,AI label setting for posts. Buffer Sign in with Buffer Feature Suggestions Roadmap What's New 9 9 AI label setting for posts Instagram and TikTok require creators to add AI generated content label to posts if a video is...,in progress,,26,https://suggestions.buffer.com/p/ai-label-setting-for-posts?b=feature-suggestions
110,109,location / default / post / having,feature suggestions,Automatic location by default,"Automatic location by default. Buffer Sign in with Buffer Feature Suggestions Roadmap What's New 9 9 Automatic location by default Hello, I work for the Instagram of several restaurants in my city, I would like the...",in progress,,26,https://suggestions.buffer.com/p/automatic-location-by-default?b=feature-suggestions
111,110,comments / posts / filter / unread,feature suggestions,"""New/Unread"" filter on Engage","""New/Unread"" filter on Engage. Buffer Sign in with Buffer Feature Suggestions Roadmap What's New 9 9 ""New/Unread"" filter on Engage In the engagement tab, I'm missing a new comments filter (those I haven't responded to...",in progress,,26,https://suggestions.buffer.com/p/new-unread-filter-on-engage?b=feature-suggestions
112,111,integration / api / ago / years,feature suggestions,Upgrades to Buffer <> Make integration,"Upgrades to Buffer <> Make integration. Buffer Sign in with Buffer Feature Suggestions Roadmap What's New 9 9 Upgrades to Buffer <> Make integration Currently, Zapier is the only integration that supports updating your...",in progress,,26,https://suggestions.buffer.com/p/upgrades-to-buffer-make-integration?b=feature-suggestions
113,112,startpage / analytics / reports / track,feature suggestions,Startpage: more analytics and integrate it in reports,Startpage: more analytics and integrate it in reports. Buffer Sign in with Buffer Feature Suggestions Roadmap What's New 9 9 Startpage: more analytics and integrate it in reports I have an image grid and it does not...,in progress,,26,https://suggestions.buffer.com/p/startpage-more-analytics-and-integrate-it-in-reports?b=feature-suggestions
114,113,shop / grid / posts / analytics,feature suggestions,Analytics on Insta's Shop Grid,Analytics on Insta's Shop Grid. Buffer Sign in with Buffer Feature Suggestions Roadmap What's New 9 9 Analytics on Insta's Shop Grid I would like to know how many clicks my posts are generating + which posts are better...,in progress,,26,https://suggestions.buffer.com/p/analytics-on-insta-s-shop-grid?b=feature-suggestions
115,114,ago / enforce / users / years,feature suggestions,Allow organisation to enforce 2FA across users,Allow organisation to enforce 2FA across users. Buffer Sign in with Buffer Feature Suggestions Roadmap What's New 9 9 Allow organisation to enforce 2FA across users Enforce all of the users on my account to enrol in...,in progress,,26,https://suggestions.buffer.com/p/allow-organisation-to-enforce-2fa-across-users?b=feature-suggestions
116,115,posts / mastodon / setting / public,feature suggestions,Set privacy setting for Mastodon posts,"Set privacy setting for Mastodon posts. Buffer Sign in with Buffer Feature Suggestions Roadmap What's New 9 9 Set privacy setting for Mastodon posts Mark posts as unlisted, followers only or public. Comments Join the...",in progress,,26,https://suggestions.buffer.com/p/set-privacy-setting-for-mastodon-posts?b=feature-suggestions
117,116,view / post / community / beta,feature suggestions,By-post view in Community,By-post view in Community. Buffer Sign in with Buffer Feature Suggestions Roadmap What's New 8 8 By-post view in Community Need to have the old community feature because it allow me to have access to the post...,in progress,,26,https://suggestions.buffer.com/p/by-post-view-in-community?b=feature-suggestions
118,117,draft / versioning / posts / suggestions,feature suggestions,Draft Versioning,"Draft Versioning. Buffer Sign in with Buffer Feature Suggestions Roadmap What's New 8 8 Draft Versioning At times, I find myself making changes to a Draft and would like to review or undo the modifications I've made....",in progress,,26,https://suggestions.buffer.com/p/draft-versioning?b=feature-suggestions
119,118,linkedin / posts / repost / future,feature suggestions,Import LinkedIn posts from others into Buffer (for future repost or comments),Import LinkedIn posts from others into Buffer (for future repost or comments). Buffer Sign in with Buffer Feature Suggestions Roadmap What's New 8 8 Import LinkedIn posts from others into Buffer (for future repost or...,in progress,,26,https://suggestions.buffer.com/p/import-linkedin-posts-from-others-into-buffer-for-future-repost-or-comments?b=feature-suggestions
120,119,comment / post / video / comments,feature suggestions,First comment bulking,First comment bulking. Buffer Sign in with Buffer Feature Suggestions Roadmap What's New 8 8 First comment bulking The first comment is an ad and should adapt to the current campaign. New feature: I can add a first...,in progress,,26,https://suggestions.buffer.com/p/first-comment-bulking?b=feature-suggestions
121,120,post / app / notifications / comments,feature suggestions,Engagement Notification in App,Engagement Notification in App. Buffer Sign in with Buffer Feature Suggestions Roadmap What's New 8 8 Engagement Notification in App This month I decided to make the switch from Sprout to Buffer. One of the features I...,planned,,26,https://suggestions.buffer.com/p/engagement-notification-in-app?b=feature-suggestions
122,121,hyperlink / label / links / custom,feature suggestions,Insert hyperlink with a custom label,Insert hyperlink with a custom label. Buffer Sign in with Buffer Feature Suggestions Roadmap What's New 8 8 Insert hyperlink with a custom label I’m not sure if it is possible. In Word and any Office programs you can...,in progress,,26,https://suggestions.buffer.com/p/insert-hyperlink-with-a-custom-label?b=feature-suggestions
123,122,comments / hide / react / ago,feature suggestions,"Ability to react to, edit or hide comments in Engagement","Ability to react to, edit or hide comments in Engagement. Buffer Sign in with Buffer Feature Suggestions Roadmap What's New 8 8 Ability to react to, edit or hide comments in Engagement We can not react, delete, hide,...",in progress,,26,https://suggestions.buffer.com/p/ability-to-react-to-edit-or-hide-comments-in-engagement?b=feature-suggestions
124,123,company / posts / better / tagging,feature suggestions,Better company tagging experience in Posts,Better company tagging experience in Posts. Buffer Sign in with Buffer Feature Suggestions Roadmap What's New 8 8 Better company tagging experience in Posts Put in part of a company name to tag (so @company) and have a...,closed,,26,https://suggestions.buffer.com/p/better-company-tagging-experience-in-posts?b=feature-suggestions
125,124,analytics / boosted / post / ago,feature suggestions,Organic vs. Boosted Post Analytics,Organic vs. Boosted Post Analytics. Buffer Sign in with Buffer Feature Suggestions Roadmap What's New 8 8 Organic vs. Boosted Post Analytics Would be nve to filter the analytics and be able to display only organic or...,in progress,,26,https://suggestions.buffer.com/p/organic-vs-boosted-post-analytics?b=feature-suggestions
126,125,analytics / posts / post / tab,feature suggestions,Create Post from Analytics Tab Feature (for reposting top old posts),Create Post from Analytics Tab Feature (for reposting top old posts). Buffer Sign in with Buffer Feature Suggestions Roadmap What's New 7 7 Create Post from Analytics Tab Feature (for reposting top old posts) All due...,in progress,,26,https://suggestions.buffer.com/p/create-post-from-analytics-tab-feature-for-reposting-top-old-posts?b=feature-suggestions
127,126,confirmation / step / publish / calendar,feature suggestions,"PLEASE add a confirmation step before ""publish now"" on calendar","PLEASE add a confirmation step before ""publish now"" on calendar. Buffer Sign in with Buffer Feature Suggestions Roadmap What's New 7 7 PLEASE add a confirmation step before ""publish now"" on calendar I can’t understand...",open,,26,https://suggestions.buffer.com/p/please-add-a-confirmation-step-before-publish-now-on-calendar?b=feature-suggestions
