cluster_rank,cluster_id,category,board,title,summary,status,votes,comments,url
128,127,logo / watermark / suggestions / able,feature suggestions,Logo watermark,Logo watermark. Buffer Sign in with Buffer Feature Suggestions Roadmap What's New 7 7 Logo watermark Would love to be able to upload a png of my logo to watermark all of my videos/photos. Comments Join the discussion...,in progress,,26,https://suggestions.buffer.com/p/logo-watermark?b=feature-suggestions
129,128,week / numbers / calendar / comments,feature suggestions,Week numbers on calendar week view,Week numbers on calendar week view. Buffer Sign in with Buffer Feature Suggestions Roadmap What's New 7 7 Week numbers on calendar week view Please add the calendar week numbers to the calendar views. Most campaigns run...,in progress,,26,https://suggestions.buffer.com/p/week-numbers-on-calendar-week-view?b=feature-suggestions
130,129,bluesky / posts / punctuation / ago,feature suggestions,Bug fix on Bluesky posts - punctuation,"Bug fix on Bluesky posts - punctuation. Buffer Sign in with Buffer Feature Suggestions Roadmap What's New 7 7 Bug fix on Bluesky posts - punctuation When queueing posts for Bluesky, there’s a glitch that un-links any...",in progress,,26,https://suggestions.buffer.com/p/bug-fix-on-bluesky-posts-punctuation?b=feature-suggestions
131,130,domain / start / page / custom,feature suggestions,Custom Domain for Start Page,Custom Domain for Start Page. Buffer Sign in with Buffer Feature Suggestions Roadmap What's New 7 7 Custom Domain for Start Page Add the option to link your custom domain via DNS records to use for your start page...,in progress,,26,https://suggestions.buffer.com/p/custom-domain-for-start-page?b=feature-suggestions
132,131,canva / graphics / comments / animations,feature suggestions,Canva Animations,"Canva Animations. Buffer Sign in with Buffer Feature Suggestions Roadmap What's New 7 7 Canva Animations I regularly share animated Canva graphics to my Instagram stories. I create and animate the graphics in Canva,...",in progress,,26,https://suggestions.buffer.com/p/canva-animations?b=feature-suggestions
133,132,post / schedule / reply / bluesky,feature suggestions,Schedule a Reply Post on Bluesky,Schedule a Reply Post on Bluesky. Buffer Sign in with Buffer Feature Suggestions Roadmap What's New 7 7 Schedule a Reply Post on Bluesky I’d like the ability to schedule a post that is a reply. I’m making a daily thread...,in progress,,26,https://suggestions.buffer.com/p/schedule-a-reply-post-on-bluesky?b=feature-suggestions
134,133,pinterest / tagged / topic / reach,feature suggestions,Pinterest - Tagged topic,Pinterest - Tagged topic. Buffer Sign in with Buffer Feature Suggestions Roadmap What's New 7 7 Pinterest - Tagged topic I would like to ask for the feature “Tagged Topics” when scheduling Pinterest posts. This feature...,in progress,,26,https://suggestions.buffer.com/p/pinterest-tagged-topic?b=feature-suggestions
135,134,location / post / tiktok / posted,feature suggestions,Add location on Tik Tok,"Add location on Tik Tok. Buffer Sign in with Buffer Feature Suggestions Roadmap What's New 7 7 Add location on Tik Tok When I post my TikTok drafts, it doesn’t offer the option to add a location like it does with...",in progress,,26,https://suggestions.buffer.com/p/add-location-on-tik-tok?b=feature-suggestions
136,135,app / comments / social / feeds,feature suggestions,Social feeds/timelines in the app,Social feeds/timelines in the app. Buffer Sign in with Buffer Feature Suggestions Roadmap What's New 7 7 Social feeds/timelines in the app We need to be able to read our own twitter timeline on Buffer like the HootSuite...,in progress,,26,https://suggestions.buffer.com/p/social-feeds-timelines-in-the-app?b=feature-suggestions
137,136,page / start / able / custom,feature suggestions,Start Page Customization,"Start Page Customization. Buffer Sign in with Buffer Feature Suggestions Roadmap What's New 7 7 Start Page Customization I am trying to further customize our Start Page. I would love to be able to add our custom fonts,...",in progress,,26,https://suggestions.buffer.com/p/start-page-customization?b=feature-suggestions
138,137,api / post / analytics / ago,feature suggestions,API for Post Analytics,"API for Post Analytics. Buffer Sign in with Buffer Feature Suggestions Roadmap What's New 7 7 API for Post Analytics Hi, We are a small company that would like to use your API in order to fetch data from out social...",in progress,,26,https://suggestions.buffer.com/p/api-for-post-analytics?b=feature-suggestions
139,138,chatgpt / plus / content / assistant,feature suggestions,Integration of Personal ChatGPT Plus Accounts into Buffer's AI Assistant,Integration of Personal ChatGPT Plus Accounts into Buffer's AI Assistant. Buffer Sign in with Buffer Feature Suggestions Roadmap What's New 7 7 Integration of Personal ChatGPT Plus Accounts into Buffer's AI Assistant...,in progress,,26,https://suggestions.buffer.com/p/integration-of-personal-chatgpt-plus-accounts-into-buffer-s-ai-assistant?b=feature-suggestions
140,139,captions / post / srt / ago,feature suggestions,Support adding captions to videos via srt file.,Support adding captions to videos via srt file.. Buffer Sign in with Buffer Feature Suggestions Roadmap What's New 7 7 Support adding captions to videos via srt file. Closed Captions are essential for creating...,closed,,26,https://suggestions.buffer.com/p/support-adding-captions-to-videos-via-srt-file?b=feature-suggestions
141,140,post / created / team / suggestions,feature suggestions,See who created a post on my team,"See who created a post on my team. Buffer Sign in with Buffer Feature Suggestions Roadmap What's New 7 7 See who created a post on my team I would like to be able to see who made a post on the calendar, or inside the...",in progress,,26,https://suggestions.buffer.com/p/see-who-created-a-post-on-my-team?b=feature-suggestions
142,141,post / recurring / holidays / day,feature suggestions,Recurring annual holidays,"Recurring annual holidays. Buffer Sign in with Buffer Feature Suggestions Roadmap What's New 6 6 Recurring annual holidays Our company has recurring days annually that we post on. For instance, our company birthday, GIS...",in progress,,26,https://suggestions.buffer.com/p/recurring-annual-holidays?b=feature-suggestions
143,142,linkedin / video / ago / thumbnail,feature suggestions,LinkedIn - update custom thumbnail when you add video,"LinkedIn - update custom thumbnail when you add video. Buffer Sign in with Buffer Feature Suggestions Roadmap What's New 6 6 LinkedIn - update custom thumbnail when you add video On LinkedIn, it would be great to have...",in progress,,26,https://suggestions.buffer.com/p/linkedin-update-custom-thumbnail-when-you-add-video?b=feature-suggestions
144,143,view / calendar / comments / set,feature suggestions,Option to Set Calendar View as the Default View,"Option to Set Calendar View as the Default View. Buffer Sign in with Buffer Feature Suggestions Roadmap What's New 6 6 Option to Set Calendar View as the Default View When I log into Buffer, I want to immediately see a...",in progress,,26,https://suggestions.buffer.com/p/option-to-set-calendar-view-as-the-default-view?b=feature-suggestions
145,144,channel / ago / channels / accounts,feature suggestions,Renaming channels within Buffer,Renaming channels within Buffer. Buffer Sign in with Buffer Feature Suggestions Roadmap What's New 6 6 Renaming channels within Buffer Buffer pulls in the channel name directly from each social channel. Some users have...,in progress,,26,https://suggestions.buffer.com/p/renaming-channels-within-buffer?b=feature-suggestions
146,145,comments / meta / manage / ads,feature suggestions,Manage comments on meta ads in Community,Manage comments on meta ads in Community. Buffer Sign in with Buffer Feature Suggestions Roadmap What's New 6 6 Manage comments on meta ads in Community Ability to manage comments on Meta ads alongside normal facebook...,in progress,,26,https://suggestions.buffer.com/p/manage-comments-on-meta-ads-in-community?b=feature-suggestions
147,146,sso / integration / suggestions / able,feature suggestions,SSO integration,"SSO integration. Buffer Sign in with Buffer Feature Suggestions Roadmap What's New 6 6 SSO integration For security, our company requires Microsoft Entra for SSO integration. Now I do not know if we will be able to use...",in progress,,26,https://suggestions.buffer.com/p/sso-integration?b=feature-suggestions
148,147,share / icon / mastodon / comments,feature suggestions,Support Buffer share icon in Mastodon with the browser extension,Support Buffer share icon in Mastodon with the browser extension. Buffer Sign in with Buffer Feature Suggestions Roadmap What's New 6 6 Support Buffer share icon in Mastodon with the browser extension Just like twitter...,in progress,,26,https://suggestions.buffer.com/p/support-buffer-share-icon-in-mastodon-with-the-browser-extension?b=feature-suggestions
149,148,engagement / post / posts / metrics,buffer api,Expose Post Engagement Metrics via the API,Expose Post Engagement Metrics via the API. Buffer Sign in with Buffer Buffer API Roadmap What's New 21 21 Expose Post Engagement Metrics via the API The Buffer GraphQL API currently supports creating and retrieving...,in progress,,26,https://suggestions.buffer.com/p/expose-post-engagement-metrics-via-the-api?b=buffer-api
150,149,media / storage / post / copy,buffer api,Copy media to Buffer storage after post creation,"Copy media to Buffer storage after post creation. Buffer Sign in with Buffer Buffer API Roadmap What's New 14 14 Copy media to Buffer storage after post creation After successful createPost, please ingest/copy media to...",in progress,,26,https://suggestions.buffer.com/p/copy-media-to-buffer-storage-after-post-creation?b=buffer-api
151,150,api / tiktok / binary / file,buffer api,Binary file upload (FILE_UPLOAD) support for TikTok in MCP API,Binary file upload (FILE_UPLOAD) support for TikTok in MCP API. Buffer Sign in with Buffer Buffer API Roadmap What's New 12 12 Binary file upload (FILE_UPLOAD) support for TikTok in MCP API Hi! Love what you're building...,in progress,,26,https://suggestions.buffer.com/p/binary-file-upload-file_upload-support-for-tiktok-in-mcp-api?b=buffer-api
152,151,api / image / upload / post,buffer api,Image assets for API,Image assets for API. Buffer Sign in with Buffer Buffer API Roadmap What's New 10 10 Image assets for API it’s a real blocker that any image to attach thorugh the API must already be hosted online somewhere. It would be...,in progress,,26,https://suggestions.buffer.com/p/image-assets-for-api?b=buffer-api
153,152,video / api / createidea / public,buffer api,Support video media in createIdea (Public API),Support video media in createIdea (Public API). Buffer Sign in with Buffer Buffer API Roadmap What's New 9 9 Support video media in createIdea (Public API) Please add full video support for createIdea. Text and image...,in progress,,26,https://suggestions.buffer.com/p/support-video-media-in-createidea-public-api?b=buffer-api
154,153,claude / code / skill / api,buffer api,can you create a claude code skill?,can you create a claude code skill?. Buffer Sign in with Buffer Buffer API Roadmap What's New 6 6 can you create a claude code skill? I use Claude Code and it’s taking it a long time to try and understand the new Buffer...,in progress,,26,https://suggestions.buffer.com/p/can-you-create-a-claude-code-skill?b=buffer-api
155,154,limit / character / characters / linkedin,buffer api,Document LinkedIn character limit and Unicode handling in Buffer docs,Document LinkedIn character limit and Unicode handling in Buffer docs. Buffer Sign in with Buffer Buffer API Roadmap What's New 4 4 Document LinkedIn character limit and Unicode handling in Buffer docs Buffer enforces a...,in progress,,26,https://suggestions.buffer.com/p/document-linkedin-character-limit-and-unicode-handling-in-buffer-docs?b=buffer-api
156,155,channel / groups / zapier / comments,buffer api,Expose channel groups in Zapier,Expose channel groups in Zapier. Buffer Sign in with Buffer Buffer API Roadmap What's New 4 4 Expose channel groups in Zapier Would be amazing to have channel groups exposed in Zapier to help minimize task usage....,in progress,,26,https://suggestions.buffer.com/p/expose-channel-groups-in-zapier?b=buffer-api
157,156,query / ideas / api / post,buffer api,"Query ""Ideas""","Query ""Ideas"". Buffer Sign in with Buffer Buffer API Roadmap What's New 1 1 Query ""Ideas"" Currently on the GraphQL API there is no Query Idea entry point. It would be great to treat Ideas as a source of truth for...",in progress,,26,https://suggestions.buffer.com/p/query-ideas?b=buffer-api
